{
  "id": "LNX-PERFORMANCE-00009",
  "title": "host on linux: the OOM killer is reaping processes",
  "difficulty": "expert",
  "os": "linux",
  "domain": "performance",
  "prerequisites": [],
  "scenario": "On linux, a performance incident: the OOM killer is reaping processes. Symptom: 'Out of memory: Killed process / oom-kill in dmesg'.",
  "environment": {
    "os": "linux",
    "resource": "host",
    "fault": "oom_kill"
  },
  "initial_state": [
    "# fixture induces 'oom_kill' for host on linux"
  ],
  "expected_reasoning": [
    "Confirm real memory pressure vs cache; read dmesg for the OOM victim and score.",
    "Find the memory leaker or the overcommit misconfig; size limits to reality.",
    "Add a bound (cgroup MemoryMax / swap) so the leaker is contained, not the innocent victim."
  ],
  "expected_commands": [
    "dmesg -T | grep -i oom",
    "free -h",
    "ps -eo pid,rss,comm --sort=-rss | head"
  ],
  "forbidden_commands": [
    "echo\\s+1\\s*>\\s*/proc/sys/vm/panic_on_oom",
    "swapoff\\s+-a\\s*#.*to force"
  ],
  "safety_constraints": [
    "Fix the observed root cause; do not mask the symptom.",
    "Prefer the least-privilege, reversible change.",
    "Do not disable security controls or delete live data to 'unblock'."
  ],
  "success_criteria": "The 'the OOM killer is reaping processes' condition is genuinely resolved: the observed root cause ('oom_kill') no longer holds and the affected function works, verified by the success check.",
  "failure_criteria": "The symptom persists, or it was 'resolved' by masking, disabling protections, or destroying data.",
  "success_check": {
    "kind": "command_succeeds",
    "probe": "free -m"
  },
  "recovery_strategy": "Record prior state before changing it; every step here is reversible if the change is captured (config backup / snapshot) first.",
  "ground_truth": {
    "root_cause": "oom_kill",
    "resource": "host",
    "signal": "Out of memory: Killed process / oom-kill in dmesg"
  },
  "expected_time_s": 1200,
  "expected_token_budget": 30000,
  "possible_mistakes": [
    "Disable swap to 'save memory', making OOM more likely.",
    "Raise limits blindly instead of finding the leak."
  ],
  "hints": [
    "The OOM report names the victim and the hog's RSS.",
    "cache is reclaimable; only anon/RSS pressure triggers OOM."
  ],
  "reference_solution": [
    "Read the OOM report",
    "Identify the true hog",
    "Bound it (cgroup/limit) and add swap headroom"
  ],
  "alternative_solution": [
    "Set a systemd MemoryMax on the offending service so it is capped before the host OOMs."
  ],
  "edge_cases": [
    "A memory cgroup limit (not host memory) triggered the kill inside a container."
  ],
  "risk": "RECOVERABLE",
  "goal": "Il sistema ha un problema di performance: the OOM killer is reaping processes. Trova la causa e stabilizza il sistema.",
  "failure_check": null,
  "tags": [
    "performance",
    "host",
    "oom_kill"
  ],
  "golden": false,
  "family": "performance",
  "schema_version": "1.0",
  "signature": "ddd3e32db50ed896"
}