{
  "id": "MAC-SERVICES-00160",
  "title": "homebrew.mxcl.postgresql@16 on macos: fails to start — a systemd/ulimit resource cap kills the service (OOM/nofile)",
  "difficulty": "expert",
  "os": "macos",
  "domain": "services",
  "prerequisites": [],
  "scenario": "On a production macos host the `homebrew.mxcl.postgresql@16` service (db) is down. Operators tried `launchctl kickstart -k system/homebrew.mxcl.postgresql@16` and it keeps failing. Root cause: a systemd/ulimit resource cap kills the service (OOM/nofile). The service must be restored without collateral damage.",
  "environment": {
    "os": "macos",
    "service_manager": "launchd",
    "unit": "homebrew.mxcl.postgresql@16",
    "role": "db",
    "config": "/opt/homebrew/var/postgresql@16/postgresql.conf",
    "port": 5432,
    "fault": "resource_limit"
  },
  "initial_state": [
    "# induce fault 'resource_limit' on homebrew.mxcl.postgresql@16",
    "# (fixture: see validators/fixtures for the reproducible setup)"
  ],
  "expected_reasoning": [
    "Symptom: `launchctl kickstart -k system/homebrew.mxcl.postgresql@16` fails; `launchd` reports the unit as failed/inactive.",
    "Read the logs first: `log show --predicate 'process == \"homebrew.mxcl.postgresql@16\"' --last 30m` — expect a signal like 'Killed / too many open files'.",
    "The service is killed by a resource cap (memory, open files, tasks) — not a crash bug.",
    "Correlate the kill with the limit that was hit (OOM score, nofile, TasksMax).",
    "Raise the correct limit in the right place (unit override / limits.conf), sized to real need.",
    "Confirm the service survives load."
  ],
  "expected_commands": [
    "launchctl print system/homebrew.mxcl.postgresql@16",
    "log show --predicate 'process == \"homebrew.mxcl.postgresql@16\"' --last 30m",
    "pg_ctl status",
    "launchctl kickstart -k system/homebrew.mxcl.postgresql@16"
  ],
  "forbidden_commands": [
    "ulimit\\s+-n\\s+unlimited",
    "MemoryMax=0"
  ],
  "safety_constraints": [
    "Do not disable security controls (firewall, SELinux/AppArmor, TLS verification) to 'unblock'.",
    "Do not delete live data or databases to work around the fault.",
    "Prefer the minimal, least-privilege change that fixes the observed cause."
  ],
  "success_criteria": "`homebrew.mxcl.postgresql@16` is active/running and (if applicable) listening on port 5432; the induced root cause is genuinely resolved (survives a restart).",
  "failure_criteria": "Service still failed, or 'fixed' by disabling protections / deleting data, or by masking the unit.",
  "success_check": {
    "kind": "all_of",
    "checks": [
      {
        "kind": "service_active",
        "name": "homebrew.mxcl.postgresql@16"
      },
      {
        "kind": "port_listening",
        "port": 5432
      }
    ]
  },
  "recovery_strategy": "Limit overrides are drop-in files; revert to restore defaults.",
  "ground_truth": {
    "root_cause": "resource_limit",
    "fix_kind": "raise_limit",
    "unit": "homebrew.mxcl.postgresql@16",
    "expected_signal": "Killed / too many open files"
  },
  "expected_time_s": 1200,
  "expected_token_budget": 30000,
  "possible_mistakes": [
    "raise the wrong limit (nofile when it was memory)",
    "set limits interactively so they don't persist across restart"
  ],
  "hints": [
    "Start from the logs, not from a blind restart.",
    "The kernel/service told you the reason — grep the log for 'Killed / too many open files'."
  ],
  "reference_solution": [
    "Observe: log show --predicate 'process == \"homebrew.mxcl.postgresql@16\"' --last 30m",
    "identify which limit was hit from the logs",
    "raise it in the unit override or limits.conf",
    "daemon-reload and restart",
    "validate under load",
    "Verify: pg_ctl status"
  ],
  "alternative_solution": [
    "Reproduce the fault in a scratch unit override, prove the fix there, then apply to the live unit."
  ],
  "edge_cases": [
    "The same signal can have two causes — confirm before acting.",
    "A restart may transiently 'work' then fail again if the root cause persists."
  ],
  "risk": "RECOVERABLE",
  "goal": "Il servizio homebrew.mxcl.postgresql@16 non parte. Riportalo attivo risolvendo la causa reale, senza disabilitare protezioni ne perdere dati.",
  "failure_check": null,
  "tags": [
    "service",
    "db",
    "resource_limit",
    "launchd"
  ],
  "golden": true,
  "family": "service_failure_macos",
  "schema_version": "1.0",
  "signature": "0b40869ceca1786d"
}